ID,nom,departement,ville,CP,type
0921606W,Ecole maternelle publique Berthe Morisot,92,Gennevilliers,92230,primaire
0921607X,Ecole élémentaire publique Croix Bosset,92,Sèvres,92310,primaire
0921608Y,Ecole élémentaire publique Joliot-Curie,92,Le-Plessis-Robinson,92350,primaire
0921609Z,Ecole élémentaire publique Léon Gambetta,92,Châtillon,92320,primaire
0921610A,Ecole élémentaire d'application Les Rochers,92,Clamart,92140,primaire
0921611B,Ecole élémentaire publique Victor Hugo,92,Colombes,92700,primaire
0921612C,Ecole élémentaire publique Henri Wallon B,92,Gennevilliers,92230,primaire
0921613D,Ecole élémentaire publique Aulagnier,92,Asnières-sur-Seine,92600,primaire
0921617H,Ecole maternelle publique George Sand,92,Rueil-Malmaison,92500,primaire
0921621M,Collège Guy Moquet,92,Gennevilliers,92230,secondaire
0921622N,Collège Auguste Renoir,92,Asnières-sur-Seine,92600,secondaire
0921623P,Collège Jean Jaurès,92,Clichy,92110,secondaire
0921624R,Section d'enseignement général et professionnel adapté du Collège Jean Macé,92,Clichy,92110,secondaire
0921625S,"Lycée professionnel Paul Painlevé, lycée des métiers du commerce, de la communication et de la gestion",92,Courbevoie,92400,secondaire
0921626T,Lycée professionnel Claude Chappe,92,Nanterre,92000,secondaire
0921627U,Section d'enseignement général et professionnel adapté du Collège Evariste Galois,92,Nanterre,92000,secondaire
0921631Y,Collège Henri Barbusse,92,Bagneux,92220,secondaire
0921634B,Ecole maternelle publique Jean Moulin,92,Colombes,92700,primaire
0921636D,Ecole maternelle publique Camille Claudel,92,Colombes,92700,primaire
0921637E,Ecole maternelle publique Jean Lurcat,92,Gennevilliers,92230,primaire
0921638F,Ecole maternelle publique Maurice Thorez,92,Bagneux,92220,primaire
0921639G,Ecole maternelle publique Joliot-Curie,92,Le-Plessis-Robinson,92350,primaire
0921640H,Ecole maternelle publique Défense 2000,92,Puteaux,92800,primaire
0921641J,Ecole élémentaire publique Louise Michel,92,Clamart,92140,primaire
0921642K,Ecole élémentaire publique Paul Vaillant-Couturier,92,Bagneux,92220,primaire
0921643L,Ecole élémentaire publique Maurice Thorez,92,Bagneux,92220,primaire
0921644M,Ecole primaire publique Robert Pontillon,92,Suresnes,92150,primaire
0921645N,Ecole élémentaire publique George Sand,92,Rueil-Malmaison,92500,primaire
0921646P,Ecole maternelle publique les Mouilleboeufs,92,Châtenay-Malabry,92290,primaire
0921647R,Ecole élémentaire publique Gustave Caillebotte,92,Gennevilliers,92230,primaire
0921648S,Ecole élémentaire publique Jean Lurçat,92,Gennevilliers,92230,primaire
0921649T,Ecole élémentaire publique Jean Jaurès,92,Clichy,92110,primaire
0921650U,Ecole élémentaire publique Gaston Ramon,92,Garches,92380,primaire
0921651V,Ecole élémentaire publique Jean de La Fontaine,92,Issy-les-Moulineaux,92130,primaire
0921652W,Ecole élémentaire publique Centre,92,Nanterre,92000,primaire
0921653X,Ecole élémentaire publique Les Cottages,92,Suresnes,92150,primaire
0921654Y,Ecole élémentaire publique Les Raguidelles,92,Suresnes,92150,primaire
0921663H,Lycée général et technologique privé Jeanne d'Arc,92,Colombes,92700,secondaire
0921669P,Ecole maternelle publique Marin Fournier,92,Clichy,92110,primaire
0921675W,Collège Marguerite Duras,92,Colombes,92700,secondaire
0921676X,"Lycée professionnel Théodore Monod, lycée des métiers de l'hôtellerie et des services à vocation internationale",92,Antony,92160,secondaire
0921677Y,Lycée professionnel Paul Langevin,92,Nanterre,92000,secondaire
0921684F,Ecole élémentaire publique République,92,Puteaux,92800,primaire
0921685G,Ecole élémentaire publique Paul Langevin,92,Nanterre,92000,primaire
0921686H,Ecole élémentaire publique Honoré de Balzac,92,Nanterre,92000,primaire
0921687J,Ecole élémentaire publique Jules Ferry,92,Levallois-Perret,92300,primaire
0921688K,Ecole élémentaire publique Le Parc,92,Fontenay-aux-Roses,92260,primaire
0921689L,Ecole élémentaire publique Henri Martin,92,Colombes,92700,primaire
0921692P,Ecole maternelle publique Les Genets,92,Courbevoie,92400,primaire
0921693R,Ecole maternelle publique Mozart,92,Courbevoie,92400,primaire
0921694S,Ecole maternelle publique Maintenon,92,Colombes,92700,primaire
0921695T,Ecole maternelle publique Arc en Ciel,92,Châtillon,92320,primaire
0921702A,Ecole maternelle publique Roule,92,Neuilly-sur-Seine,92200,primaire
0921704C,Ecole élémentaire publique Maurice Ravel,92,Levallois-Perret,92300,primaire
0921708G,Ecole élémentaire publique Maxime Gorki,92,Nanterre,92000,primaire
0921769Y,Ecole maternelle publique Marceau,92,Vanves,92170,primaire
0921771A,Ecole maternelle publique Casteja,92,Boulogne-Billancourt,92100,primaire
0921777G,Section d'enseignement général et professionnel adapté du Collège Jean Perrin,92,Nanterre,92000,secondaire
0921778H,Collège Joliot-Curie,92,Bagneux,92220,secondaire
0921779J,Collège Albert Camus,92,Bois-Colombes,92270,secondaire
0921780K,Collège Louis Pasteur,92,Neuilly-sur-Seine,92200,secondaire
0921781L,Collège Théophile Gautier,92,Neuilly-sur-Seine,92200,secondaire
0921782M,Collège Rabelais,92,Meudon,92190,secondaire
0921783N,Collège Michelet,92,Vanves,92174,secondaire
0921784P,Collège Lakanal,92,Sceaux,92330,secondaire
0921785R,Collège Marie Curie,92,Sceaux,92331,secondaire
0921786S,Collège Descartes,92,Antony,92160,secondaire
0921792Y,Ecole maternelle publique Val de Bievres,92,Antony,92160,primaire
0921793Z,Ecole maternelle publique Dunoyer de Segonzac,92,Antony,92160,primaire
0921794A,Ecole maternelle publique Belle Feuille,92,Boulogne-Billancourt,92100,primaire
0921795B,Ecole maternelle publique Gallieni,92,Boulogne-Billancourt,92100,primaire
0921796C,Ecole maternelle publique Louis-Hubert Allie,92,Courbevoie,92400,primaire
0921797D,Ecole maternelle publique Claude Boujon,92,Issy-les-Moulineaux,92130,primaire
0921798E,Ecole maternelle publique Marcellin Berthelot,92,Montrouge,92120,primaire
0921799F,Ecole maternelle publique Maxime Gorki,92,Nanterre,92000,primaire
0921800G,Ecole élémentaire publique Marceau,92,Vanves,92170,primaire
0921801H,Ecole élémentaire d'application Eugène Petitot,92,Puteaux,92800,primaire
0921802J,Ecole élémentaire publique Marius Jacotot,92,Puteaux,92800,primaire
0921803K,Ecole élémentaire publique Jules Ferry A,92,Nanterre,92000,primaire
0921804L,Ecole élémentaire publique Joliot-Curie,92,Nanterre,92000,primaire
0921805M,Ecole primaire publique Anatole France,92,Levallois-Perret,92300,primaire
0921806N,Ecole élémentaire publique Maria Brignole de Galliera,92,Clamart,92140,primaire
0921807P,Ecole élémentaire publique Joliot-Curie,92,Bagneux,92220,primaire
0921808R,Ecole primaire publique Paul Eluard,92,Bagneux,92220,primaire
0921809S,Ecole élémentaire publique Dunoye de Segonzac,92,Antony,92160,primaire
0921815Y,Ecole primaire publique Pablo Neruda,92,Nanterre,92000,primaire
0921817A,Ecole maternelle publique Boisseau,92,Clichy,92110,primaire
0921830P,Ecole maternelle publique Bas Coquarts,92,Bourg-la-Reine,92340,primaire
0921831R,Ecole maternelle publique La Marelle,92,Courbevoie,92400,primaire
0921833T,Ecole maternelle publique Les Epinettes,92,Issy-les-Moulineaux,92130,primaire
0921835V,Ecole maternelle publique Les Paquerettes,92,Chaville,92370,primaire
0921836W,Ecole maternelle publique Les Myosotis,92,Chaville,92370,primaire
0921838Y,Ecole élémentaire publique Les Epinettes,92,Issy-les-Moulineaux,92130,primaire
0921839Z,Ecole primaire publique Fouilleuse,92,Saint-Cloud,92210,primaire
0921842C,Ecole élémentaire publique Denis Diderot A,92,Gennevilliers,92230,primaire
0921843D,Ecole élémentaire publique Denis Diderot B,92,Gennevilliers,92230,primaire
0921844E,Ecole primaire publique Anatole France,92,Nanterre,92000,primaire
0921845F,Ecole élémentaire publique Jules Ferry,92,Issy-les-Moulineaux,92130,primaire
0921868F,Collège Henri Georges Adam,92,Antony,92160,secondaire
0921877R,Ecole élémentaire publique Casteja,92,Boulogne-Billancourt,92100,primaire
0921878S,Ecole élémentaire publique Georges Cogniot,92,Malakoff,92240,primaire
0921879T,Ecole maternelle publique Jean Jaurès,92,Châtillon,92320,primaire
0921880U,Ecole maternelle publique Georges Cogniot,92,Malakoff,92240,primaire
0921881V,Ecole élémentaire publique Alexandre Dumas,92,Courbevoie,92400,primaire
0921882W,Ecole primaire publique Jean Jaurès,92,Le-Plessis-Robinson,92350,primaire
0921884Y,Ecole maternelle publique Forum,92,Boulogne-Billancourt,92100,primaire
0921899P,Ecole primaire privée Rambam,92,Boulogne-Billancourt,92100,primaire
0921901S,Collège privé Sainte Marie La Croix,92,Antony,92160,secondaire
0921902T,Collège privé Sainte Geneviève,92,Asnières-sur-Seine,92600,secondaire
0921903U,Collège privé Saint Gabriel,92,Bagneux,92220,secondaire
0921904V,Collège privé Rambam,92,Boulogne-Billancourt,92100,secondaire
0921905W,Collège privé Notre-Dame,92,Bourg-la-Reine,92340,secondaire
0921906X,Collège privé Sophie Barat,92,Châtenay-Malabry,92290,secondaire
0921907Y,Collège privé Saint Thomas de Villeneuve,92,Chaville,92370,secondaire
0921908Z,Collège privé Jeanne d'Arc,92,Colombes,92700,secondaire
0921909A,Collège privé La Source,92,Meudon,92190,secondaire
0921911C,Collège privé Jeanne d'Arc,92,Montrouge,92120,secondaire
0921912D,Collège privé Sainte Marie,92,Neuilly-sur-Seine,92200,secondaire
0921913E,Collège privé Notre-Dame de Sainte Croix,92,Neuilly-sur-Seine,92200,secondaire
0921914F,Collège privé Saint Dominique,92,Neuilly-sur-Seine,92203,secondaire
0921915G,Collège privé La Salle Passy Buzenval,92,Rueil-Malmaison,92508,secondaire
0921916H,Collège privé Madeleine Danielou,92,Rueil-Malmaison,92500,secondaire
0921918K,Collège privé Sainte Jeanne d'Arc,92,Sceaux,92330,secondaire
0921919L,Collège privé Suger,92,Vaucresson,92420,secondaire
0921922P,Ecole élémentaire publique Guynemer,92,Courbevoie,92400,primaire
0921923R,Ecole maternelle publique Les Ponceaux,92,Issy-les-Moulineaux,92130,primaire
0921932A,Lycée professionnel privé La Salle Passy Buzenval,92,Rueil-Malmaison,92508,secondaire
0921935D,Etablissement régional d'enseignement adapté Toulouse Lautrec,92,Vaucresson,92420,secondaire
0921940J,Collège Paul Eluard,92,Nanterre,92000,secondaire
0921941K,Ecole maternelle publique Moulin de Pierre,92,Clamart,92140,primaire
0921942L,Ecole élémentaire publique Le Moulin de Pierre,92,Clamart,92140,primaire
0921943M,Ecole élémentaire publique Jules Ferry,92,Clamart,92140,primaire
0921944N,Ecole élémentaire publique Charles de Gaulle,92,Clamart,92140,primaire
0921945P,Ecole maternelle d'application Ravel-Prévert,92,Meudon,92360,primaire
0921990N,Ecole maternelle publique Jacques Prévert,92,Clichy,92110,primaire
0921991P,Ecole maternelle publique Les Fauvelles,92,Courbevoie,92400,primaire
0921992R,Ecole maternelle publique Les Ormeaux,92,Fontenay-aux-Roses,92260,primaire
0921994T,Ecole maternelle publique Sonia Delaunay,92,Villeneuve-la-Garenne,92390,primaire
0921995U,Ecole élémentaire publique Les Renards,92,Fontenay-aux-Roses,92260,primaire
0922014P,Ecole maternelle publique Fontanes,92,Courbevoie,92400,primaire
0922019V,Ecole maternelle publique Les Deux Coupoles,92,Puteaux,92800,primaire
0922020W,Collège Les Renardières,92,Courbevoie,92400,secondaire
0922021X,Ecole primaire publique Max Fourestier,92,Vanves,92170,primaire
0922022Y,Ecole maternelle d'application du Mesnil,92,Asnières-sur-Seine,92600,primaire
0922023Z,Ecole élémentaire publique Les Buissonnets,92,Rueil-Malmaison,92500,primaire
0922024A,Ecole élémentaire publique Robespierre,92,Nanterre,92000,primaire
0922025B,Ecole élémentaire publique Maritain Renan,92,Meudon,92190,primaire
0922026C,Ecole élémentaire publique Guy Môquet,92,Malakoff,92240,primaire
0922027D,Ecole primaire publique Noyer Doré,92,Antony,92160,primaire
0922030G,Ecole élémentaire publique Jean Jaurès,92,Malakoff,92240,primaire
0922037P,Ecole maternelle publique Les Vanettes,92,Courbevoie,92400,primaire
0922046Z,Ecole maternelle publique Jean Guillon,92,Boulogne-Billancourt,92100,primaire
0922047A,Ecole primaire publique Elsa Triolet,92,Nanterre,92000,primaire
0922048B,Ecole maternelle publique Jacques Prévert,92,Nanterre,92000,primaire
0922049C,Ecole maternelle publique Parmentier,92,Puteaux,92800,primaire
0922050D,Ecole élémentaire publique Buffon,92,Colombes,92700,primaire
0922051E,Ecole élémentaire publique La Fontaine,92,Nanterre,92000,primaire
0922053G,Ecole maternelle publique Aristide Briand,92,Courbevoie,92400,primaire
0922085S,Ecole maternelle publique Ancien Couvent,92,Puteaux,92800,primaire
0922086T,Ecole élémentaire publique Paul Bert,92,Chaville,92370,primaire
0922087U,Ecole élémentaire publique Henri Wallon,92,Nanterre,92000,primaire
0922095C,Ecole maternelle publique Anne Frank,92,Asnières-sur-Seine,92600,primaire
0922098F,Ecole primaire publique La Rotonde,92,Puteaux,92800,primaire
0922099G,Ecole maternelle publique Charles Perrault,92,Courbevoie,92400,primaire
0922100H,Ecole élémentaire publique André Malraux,92,Courbevoie,92400,primaire
0922104M,Ecole primaire publique André Pasquier,92,Antony,92160,primaire
0922105N,Ecole élémentaire publique Adolphe Thiers,92,Boulogne-Billancourt,92100,primaire
0922106P,Ecole élémentaire publique Sédar Senghor,92,Clamart,92140,primaire
0922107R,Ecole élémentaire publique Voltaire,92,Nanterre,92000,primaire
0922110U,Ecole primaire privée Montessori Bilingue,92,Saint-Cloud,92210,primaire
0922111V,Ecole primaire privée Sainte Geneviève,92,Courbevoie,92400,primaire
0922112W,Ecole maternelle privée Saint Pierre Saint Paul,92,Courbevoie,92400,primaire
0922118C,Ecole maternelle publique Abondances,92,Boulogne-Billancourt,92100,primaire
0922119D,Ecole primaire d'application Gorce Franklin,92,Neuilly-sur-Seine,92200,primaire
0922121F,Ecole maternelle publique Anne Frank,92,Colombes,92700,primaire
0922123H,Ecole maternelle publique Jules Verne,92,Courbevoie,92400,primaire
0922124J,Ecole maternelle publique Henri Dunant,92,Suresnes,92150,primaire
0922125K,Ecole maternelle publique Les Varennes,92,Issy-les-Moulineaux,92130,primaire
0922126L,Ecole élémentaire publique Marcel Achard,92,Courbevoie,92400,primaire
0922127M,Ecole élémentaire publique Joliot-Curie,92,Châtillon,92320,primaire
0922134V,Ecole maternelle publique Condorcet,92,Clichy,92110,primaire
0922135W,Ecole maternelle publique Parc Cheviron,92,Sèvres,92310,primaire
0922136X,Ecole élémentaire publique Les Ajoncs,92,Issy-les-Moulineaux,92130,primaire
0922138Z,Ecole élémentaire publique Les Pâquerettes,92,Nanterre,92000,primaire
0922142D,Ecole primaire privée Saint Leufroy,92,Suresnes,92150,primaire
0922143E,Collège Yves du Manoir,92,Vaucresson,92420,secondaire
0922144F,Ecole maternelle publique Jean Moulin,92,Antony,92160,primaire
0922145G,Ecole maternelle publique Concorde,92,Asnières-sur-Seine,92600,primaire
0922146H,Ecole maternelle publique Claude Lemel,92,Vanves,92170,primaire
0922147J,Ecole maternelle publique jean monnet,92,Clamart,92140,primaire
0922148K,"Groupe scolaire Saint-Germain, les Iles, Chabanne",92,Issy-les-Moulineaux,92130,primaire
0922149L,"Lycée polyvalent  Auffray, lycée des métiers de l'hôtellerie-tourisme, de la santé et du social",92,Clichy,92582,secondaire
0922151N,Ecole maternelle publique Pablo Picasso,92,Nanterre,92000,primaire
0922152P,Ecole élémentaire publique Louis Pasteur,92,Rueil-Malmaison,92500,primaire
0922153R,Ecole élémentaire publique  Camus-Pasteur,92,Meudon,92360,primaire
0922192H,Ecole maternelle publique Saint-Exupéry,92,Levallois-Perret,92300,primaire
0922202U,Section d'enseignement professionnel du lycée polyvalent Newton Enrea,92,Clichy,92110,secondaire
0922203V,Section d'enseignement professionnel du lycée polyvalent Auffray,92,Clichy,92110,secondaire
0922223S,Ecole maternelle publique Pierre Mendès France,92,Clichy,92110,primaire
0922225U,Ecole élémentaire publique Sèvres,92,Boulogne-Billancourt,92100,primaire
0922226V,Ecole élémentaire publique Joliot-Curie,92,Gennevilliers,92230,primaire
0922228X,Ecole élémentaire publique Jacques Decour A,92,Nanterre,92000,primaire
0922229Y,Ecole primaire public Lucie Aubrac,92,Nanterre,92000,primaire
0922230Z,Ecole maternelle publique Le Parc,92,Asnières-sur-Seine,92600,primaire
0922233C,Ecole élémentaire publique Jean Monnet,92,Clamart,92140,primaire
0922236F,Ecole primaire privée Yaguel Yaacov,92,Montrouge,92120,primaire
0922247T,Collège La Paix,92,Issy-les-Moulineaux,92130,secondaire
0922249V,Lycée polyvalent Montesquieu,92,Le-Plessis-Robinson,92350,secondaire
0922250W,Ecole primaire publique Pyramide,92,Puteaux,92800,primaire
0922254A,Ecole élémentaire publique Buffalo,92,Montrouge,92120,primaire
0922256C,Collège privé Chambertin,92,Asnières-sur-Seine,92600,secondaire
0922273W,Ecole régionale du premier degré Centre Toulouse Lautrec,92,Vaucresson,92420,primaire
0922276Z,"Lycée polyvalent Santos Dumont, lycée des métiers de l'hotellerie et de la gestion des entreprises",92,Saint-Cloud,92210,secondaire
0922277A,Lycée polyvalent Charles Petiet,92,Villeneuve-la-Garenne,92391,secondaire
0922278B,Ecole primaire publique Claude Monet,92,Rueil-Malmaison,92500,primaire
0922279C,Ecole élémentaire publique  Louis Aragon,92,Clichy,92110,primaire
0922280D,Ecole primaire publique Les Sablons,92,Châtillon,92320,primaire
0922281E,Ecole élémentaire publique Le Parc,92,Suresnes,92150,primaire
0922282F,Ecole primaire publique Achille Perreti,92,Neuilly-sur-Seine,92200,primaire
0922283G,Ecole Régionale du Premier Degré Jacques Brel,92,Garches,92380,primaire
0922284H,Ecole élémentaire publique Saint-Exupéry,92,Bois-Colombes,92270,primaire
0922285J,Ecole maternelle publique  La Farandole,92,Courbevoie,92400,primaire
0922286K,Ecole maternelle publique Charles Perrault,92,Levallois-Perret,92300,primaire
0922287L,Etablissement régional d'enseignement adapté Jacques Brel,92,Garches,92380,secondaire
0922289N,Section d'enseignement professionnel du lycée polyvalent Montesquieu,92,Le-Plessis-Robinson,92350,secondaire
0922290P,Section d'enseignement professionnel du lycée polyvalent Charles Petiet,92,Villeneuve-la-Garenne,92391,secondaire
0922291R,Section d'enseignement professionnel du lycée polyvalent Santos Dumont,92,Saint-Cloud,92210,secondaire
0922339T,Section d'enseignement professionnel du lycée polyvalent Leonard de Vinci,92,Levallois-Perret,92304,secondaire
0922340U,Collège privé Saint Philippe,92,Meudon,92190,secondaire
0922349D,Ecole primaire publique La Malmaison,92,Rueil-Malmaison,92500,primaire
0922351F,Section d'enseignement général et professionnel adapté du Collège Robert Doisneau,92,Montrouge,92120,secondaire
0922352G,Section d'enseignement professionnel privée du lycée polyvalent Montalembert,92,Courbevoie,92400,secondaire
0922359P,Ecole élémentaire publique Jean de La Fontaine,92,Levallois-Perret,92300,primaire
0922360R,Ecole élémentaire publique Alfred de Musset,92,Levallois-Perret,92300,primaire
0922363U,Ecole maternelle publique Les Ajoncs,92,Courbevoie,92400,primaire
0922364V,Section d'enseignement professionnel du lycée polyvalent Jean Jaurès,92,Châtenay-Malabry,92291,secondaire
0922367Y,Ecole primaire privée Ozar Hathorah,92,Antony,92160,primaire
0922371C,Collège privé Ozar Hatorah,92,Antony,92160,secondaire
0922380M,Ecole maternelle publique Peupliers,92,Boulogne-Billancourt,92100,primaire
0922381N,Ecole primaire publique Robert Doisneau,92,Issy-les-Moulineaux,92130,primaire
0922390Y,Ecole maternelle publique Annie Fratellini,92,Clichy,92110,primaire
0922394C,Ecole élémentaire privée Arménienne Tarkmantchatz,92,Issy-les-Moulineaux,92130,primaire
0922397F,Lycée polyvalent Eugène Ionesco,92,Issy-les-Moulineaux,92130,secondaire
0922398G,"Lycée polyvalent Gustave Eiffel, lycée des métiers de la santé, de la communication et du commerce",92,Rueil-Malmaison,92500,secondaire
0922402L,Ecole maternelle publique Brimborion,92,Sèvres,92310,primaire
0922403M,Ecole maternelle publique Alfred de Musset,92,Levallois-Perret,92300,primaire
0922404N,Section d'enseignement professionnel du lycée polyvalent Eugène Ionesco,92,Issy-les-Moulineaux,92130,secondaire
0922405P,Section d'enseignement professionnel du lycée polyvalent Gustave Eiffel,92,Rueil-Malmaison,92500,secondaire
0922422H,Ecole primaire publique Françoise Dolto,92,Bois-Colombes,92270,primaire
0922423J,Ecole primaire publique Jean de La Fontaine,92,Clamart,92140,primaire
0922424K,Ecole élémentaire publique La Bruyère,92,Courbevoie,92400,primaire
0922425L,Ecole primaire publique Marcel Pagnol,92,Colombes,92700,primaire
0922426M,Ecole élémentaire publique Jules Ferry B,92,Nanterre,92000,primaire
0922427N,"Lycée polyvalent Claude Garamont, lycée des métiers des industries et arts graphiques",92,Colombes,92701,secondaire
0922428P,Section d'enseignement professionnel du lycée polyvalent Claude Garamont,92,Colombes,92701,secondaire
0922443F,"Lycée polyvalent  Etienne-Jules Marey, lycée des métiers de la petite enfance et des soins à la personne",92,Boulogne-Billancourt,92100,secondaire
0922444G,Section d'enseignement professionnel du lycée polyvalent Etienne Jules Marey,92,Boulogne-Billancourt,92100,secondaire
0922445H,Ecole élémentaire publique Pierre Loti,92,Bourg-la-Reine,92340,primaire
0922446J,Ecole primaire publique Jean Moulin,92,Rueil-Malmaison,92500,primaire
0922447K,Ecole primaire public George Sand,92,Levallois-Perret,92300,primaire
0922448L,Ecole primaire publique Le Colombier,92,Issy-les-Moulineaux,92130,primaire
0922450N,Collège privé Notre-Dame,92,Meudon,92190,secondaire
0922453S,Ecole maternelle publique Du Landy,92,Clichy,92110,primaire
0922456V,Ecole primaire publique Auguste Rodin,92,Courbevoie,92400,primaire
0922457W,Ecole élémentaire publique Antoine de Saint-Exupéry,92,Issy-les-Moulineaux,92130,primaire
0922458X,Ecole élémentaire publique Françoise Dolto,92,Levallois-Perret,92300,primaire
0922459Y,Ecole maternelle publique  Maurice Ravel,92,Levallois-Perret,92300,primaire
0922460Z,Ecole maternelle publique Saint-Exupéry,92,Suresnes,92150,primaire
0922461A,Ecole maternelle publique Louis Pasteur,92,Levallois-Perret,92300,primaire
0922463C,Ecole maternelle publique Haut-Mesnil,92,Montrouge,92120,primaire
0922464D,Lycée polyvalent Louise Michel,92,Nanterre,92000,secondaire
0922465E,Section d'enseignement professionnel du lycée polyvalent Louise Michel,92,Nanterre,92000,secondaire
0922470K,Ecole maternelle publique Michel Maurice-Bokanowski,92,Asnières-sur-Seine,92600,primaire
0922474P,Ecole maternelle publique Joachim du Bellay,92,Courbevoie,92400,primaire
0922475R,Ecole élémentaire publique Ronsard,92,Courbevoie,92400,primaire
0922476S,Ecole maternelle publique Watteau,92,Courbevoie,92400,primaire
0922477T,Ecole maternelle publique République,92,Suresnes,92150,primaire
0922478U,Ecole primaire publique Albert Camus,92,Rueil-Malmaison,92500,primaire
0922479V,Ecole maternelle publique Louis Pasteur,92,Saint-Cloud,92210,primaire
0922482Y,Collège privé Hautefeuille,92,Courbevoie,92400,secondaire
0922486C,Ecole maternelle  privée juive,92,Levallois-Perret,92300,primaire
0922522S,Ecole maternelle publique Sophie Foucault,92,Clichy,92110,primaire
0922523T,Collège les Bruyères,92,Courbevoie,92400,secondaire
0922551Y,Ecole maternelle publique Aguado,92,Gennevilliers,92230,primaire
0922552Z,Ecole élémentaire publique Maître Jacques,92,Boulogne-Billancourt,92100,primaire
0922553A,Ecole primaire  publique Jean Mermoz,92,Courbevoie,92400,primaire
0922554B,Ecole maternelle publique Jean de La Fontaine,92,Villeneuve-la-Garenne,92390,primaire
0922560H,Ecole élémentaire publique Jacques Decour B,92,Nanterre,92000,primaire
0922565N,Collège Francois Truffaut,92,Asnières-sur-Seine,92600,secondaire
0922567R,Ecole maternelle publique Françoise Dolto,92,Courbevoie,92400,primaire
0922568S,Ecole primaire publique Marcel Mouloudji,92,Suresnes,92150,primaire
0922569T,Ecole primaire publique Léopold Sédar Senghor,92,Clichy,92110,primaire
0922571V,Ecole Elémentaire privée Bilingue,92,La-Garenne-Colombes,92250,primaire
0922572W,Ecole maternelle publique Jacques Deray,92,Boulogne-Billancourt,92100,primaire
0922576A,Ecole maternelle publique Maurice Arnoux,92,Montrouge,92120,primaire
0922577B,Ecole maternelle publique Amaury Duval,92,Montrouge,92120,primaire
0922578C,Collège Georges Seurat,92,Courbevoie,92400,secondaire
0922579D,Ecole de danse de l'Opéra de Paris,92,Nanterre,92000,secondaire
0922580E,Ecole maternelle Everest,92,Boulogne-Billancourt,92100,primaire
0922581F,Ecole maternelle publique Louise Michel,92,Gennevilliers,92230,primaire
0922582G,Ecole primaire publique La Cigogne,92,Bois-Colombes,92270,primaire
0922583H,Ecole élémentaire publique Jean d'Ormesson,92,Asnières-sur-Seine,92600,primaire
0922587M,Ecole élémentaire publique Simone Veil,92,Asnières-sur-Seine,92600,primaire
0922591S,Ecole maternelle publique Réjane,92,Asnières-sur-Seine,92600,primaire
0922595W,Collège Vincent Van Gogh,92,Clichy,92110,secondaire
0922598Z,Ecole maternelle Petite Ecole Bilingue,92,Boulogne-Billancourt,92100,primaire
0922599A,Ecole élémentaire publique les Mouilleboeufs,92,Châtenay-Malabry,92290,primaire
0922600B,Ecole primaire  publique Gramme,92,Bois-Colombes,92270,primaire
0922601C,Ecole maternelle publique Fernand Léger,92,Malakoff,92240,primaire
0922602D,Ecole élémentaire publique Pablo Picasso,92,Nanterre,92000,primaire
0922610M,Collège Georges Mandel,92,Issy-les-Moulineaux,92130,secondaire
0922615T,Lycée d'enseignement général Lucie Aubrac,92,Courbevoie,92400,secondaire
0922617V,Ecole maternelle publique Révérend-Père Gilbert,92,Asnières-sur-Seine,92600,primaire
0922618W,Ecole maternelle publique le moulin des Gibets,92,Nanterre,92000,primaire
0922619X,Ecole primaire publique Camille Claudel,92,Courbevoie,92400,primaire
0922629H,Collège Jean Mermoz,92,Bois-Colombes,92270,secondaire
