ID,nom,departement,ville,CP,type
0780655N,Ecole maternelle Centre,78,Maurepas,78310,primaire
0780656P,Collège Benjamin Franklin,78,Épône,78680,secondaire
0780658S,Ecole maternelle Le Parc,78,Andrésy,78570,primaire
0780659T,Ecole maternelle Marie Curie,78,Beynes,78650,primaire
0780660U,Ecole maternelle Frédéric Mistral,78,Carrières-sous-Poissy,78955,primaire
0780664Y,Ecole élémentaire Henri Prou,78,Les-Clayes-sous-Bois,78340,primaire
0780665Z,Ecole maternelle Henri Prou,78,Les-Clayes-sous-Bois,78340,primaire
0780666A,Ecole élémentaire Grandes Terres,78,Conflans-Sainte-Honorine,78700,primaire
0780667B,Ecole maternelle Grandes Terres,78,Conflans-Sainte-Honorine,78700,primaire
0780670E,Ecole maternelle Francine Fromont,78,Guyancourt,78280,primaire
0780671F,Ecole élémentaire Georges Politzer,78,Guyancourt,78280,primaire
0780672G,Ecole élémentaire Les Cytises,78,Magnanville,78200,primaire
0780678N,Ecole élémentaire Louis Pasteur,78,Meulan-en-Yvelines,78250,primaire
0780679P,Ecole élémentaire Jean Jaurès,78,Les-Mureaux,78130,primaire
0780681S,Ecole maternelle Louise Michel,78,Plaisir,78370,primaire
0780682T,Ecole élémentaire Jules Vallès,78,Plaisir,78370,primaire
0780683U,Ecole élémentaire Jean Moulin,78,Saint-Rémy-lès-Chevreuse,78470,primaire
0780684V,Ecole maternelle Pierre Brossolette,78,Sartrouville,78500,primaire
0780685W,Ecole élémentaire Pierre Brossolette,78,Sartrouville,78500,primaire
0780686X,Ecole maternelle Jean-Baptiste Clément,78,Trappes,78190,primaire
0780687Y,Ecole élémentaire Jean-Baptiste Clément,78,Trappes,78190,primaire
0780688Z,Ecole maternelle Exelmans,78,Vélizy-Villacoublay,78140,primaire
0780689A,Ecole élémentaire Clément Ader,78,Versailles,78000,primaire
0780690B,Ecole maternelle Bois de l'Etang,78,La-Verrière,78320,primaire
0780692D,Ecole élémentaire du pré du bourg,78,Orgerus,78910,primaire
0780694F,Ecole élémentaire Jean Jaurès,78,Saint-Rémy-lès-Chevreuse,78470,primaire
0780698K,Ecole maternelle Les Glycines,78,Mantes-la-Jolie,78200,primaire
0780700M,Ecole élémentaire Victor Duruy,78,Beynes,78650,primaire
0780701N,Ecole maternelle Pauline Kergomard,78,Noisy-le-Roi,78590,primaire
0780702P,Ecole maternelle La Romanie,78,Les-Essarts-le-Roi,78690,primaire
0780707V,Collège Marcel Pagnol,78,Bonnières-sur-Seine,78270,secondaire
0780708W,Collège Jules Ferry,78,Mantes-la-Jolie,78200,secondaire
0780709X,Collège de La Mauldre,78,Maule,78580,secondaire
0780710Y,Section d'enseignement général et professionnel adapté du Collège Henri IV,78,Meulan-en-Yvelines,78250,secondaire
0780711Z,Section d'enseignement général et professionnel adapté du Collège Paul Verlaine,78,Les-Mureaux,78130,secondaire
0780712A,Collège Georges Brassens,78,Saint-Arnoult-en-Yvelines,78730,secondaire
0780713B,Collège François Rabelais,78,Beynes,78650,secondaire
0780714C,Collège Les Hauts Grillets,78,Saint-Germain-en-Laye,78100,secondaire
0780715D,Collège Martin Luther King,78,Buc,78530,secondaire
0780718G,Collège Raymond Poincaré,78,Versailles,78000,secondaire
0780720J,Collège Alexandre Dumas,78,Maurepas,78310,secondaire
0780722L,Ecole maternelle clos martin,78,Auffargis,78610,primaire
0780723M,Ecole maternelle Mozart,78,Le-Chesnay,78150,primaire
0780724N,Ecole maternelle Irène Joliot-Curie,78,Chevreuse,78460,primaire
0780726R,Ecole maternelle Danièle Casanova,78,Plaisir,78370,primaire
0780728T,Ecole maternelle Guhermont,78,Saint-Arnoult-en-Yvelines,78730,primaire
0780729U,Ecole maternelle Anne Frank,78,Trappes,78190,primaire
0780730V,Ecole maternelle Gustave Flaubert,78,Trappes,78190,primaire
0780733Y,Ecole élémentaire Nouvelle Amsterdam,78,Élancourt,78990,primaire
0780735A,Ecole élémentaire Emile Zola,78,Les-Mureaux,78130,primaire
0780736B,Ecole élémentaire Exelmans,78,Vélizy-Villacoublay,78140,primaire
0780737C,Ecole élémentaire Bois de L'Etang,78,La-Verrière,78320,primaire
0780738D,Ecole élémentaire Marsinval,78,Vernouillet,78540,primaire
0780740F,Ecole élémentaire André Gide,78,Magny-les-Hameaux,78114,primaire
0780741G,Ecole maternelle Jacques Prévert,78,Beynes,78650,primaire
0780742H,Ecole maternelle Nouvelle Amsterdam,78,Élancourt,78990,primaire
0780743J,Ecole maternelle Emile Zola,78,Les-Mureaux,78130,primaire
0780744K,Ecole maternelle Victor Hugo,78,Les-Mureaux,78130,primaire
0780745L,Ecole secondaire technique privée La Maison,78,Buc,78530,secondaire
0780746M,Ecole maternelle Georges Brassens,78,Sartrouville,78500,primaire
0780753V,Ecole maternelle André Gide,78,Magny-les-Hameaux,78114,primaire
0780754W,Ecole maternelle Charles Vauthier,78,Flins-sur-Seine,78410,primaire
0780758A,Collège Albert Camus,78,Gargenville,78440,secondaire
0780759B,Section d'enseignement général et professionnel adapté du Collège La Vaucouleurs,78,Mantes-la-Ville,78711,secondaire
0780760C,Collège La Fosse Aux Dames,78,Les-Clayes-sous-Bois,78340,secondaire
0780761D,Collège Guillaume Apollinaire,78,Plaisir,78375,secondaire
0780764G,Ecole élémentaire,78,Saint-Lambert,78470,primaire
0780765H,Ecole élémentaire Pierre Brossolette,78,Plaisir,78370,primaire
0780766J,Ecole élémentaire Denouval,78,Andrésy,78570,primaire
0780767K,Ecole élémentaire Berceau,78,Élancourt,78990,primaire
0780769M,Ecole élémentaire Gabriel Bouvet,78,Coignières,78310,primaire
0780770N,Ecole élémentaire Louis Jouvet,78,Achères,78260,primaire
0780772R,Ecole maternelle Hélène Boucher,78,Jouars-Pontchartrain,78760,primaire
0780773S,Ecole maternelle Le Parc,78,Bois-d'Arcy,78390,primaire
0780774T,Ecole maternelle Champ de La Poussinière,78,Orgerus,78910,primaire
0780775U,Ecole maternelle,78,Le-Perray-en-Yvelines,78610,primaire
0780776V,Ecole maternelle,78,Septeuil,78790,primaire
0780777W,Ecole maternelle Gabriel Bouvet,78,Coignières,78310,primaire
0780778X,Ecole maternelle Jean de La Fontaine,78,Orgeval,78630,primaire
0780781A,Ecole maternelle Les Goélands,78,Carrières-sous-Poissy,78955,primaire
0780784D,Ecole maternelle Marsinval,78,Vernouillet,78540,primaire
0780785E,Ecole maternelle Louis Jouvet,78,Achères,78260,primaire
0780786F,Ecole maternelle Les Charvaux,78,Andrésy,78570,primaire
0780787G,Ecole maternelle Denouval,78,Andrésy,78570,primaire
0780789J,Ecole maternelle Chardrottes,78,Chatou,78400,primaire
0780790K,Ecole maternelle Champs Moutons,78,Chatou,78400,primaire
0780791L,Ecole maternelle Le Berceau,78,Élancourt,78990,primaire
0780792M,Ecole maternelle Les Lutins,78,Élancourt,78990,primaire
0780794P,Ecole maternelle,78,Guerville,78930,primaire
0780795R,Ecole maternelle Le Parc,78,Juziers,78820,primaire
0780796S,Ecole maternelle Les Violettes,78,Mareil-Marly,78750,primaire
0780797T,Ecole maternelle Villeparc,78,Maurepas,78310,primaire
0780798U,Ecole maternelle Champmesnil,78,Le-Mesnil-Saint-Denis,78320,primaire
0780799V,Ecole maternelle Antoine de Saint-Exupéry,78,Poissy,78300,primaire
0780800W,Ecole maternelle Petit Bontemps,78,Plaisir,78370,primaire
0780801X,Ecole maternelle Anne Frank,78,Sartrouville,78500,primaire
0780802Y,Ecole maternelle Beethoven,78,Saint-Germain-en-Laye,78100,primaire
0780803Z,Ecole maternelle Elie Ferrier,78,Saint-Germain-de-la-Grange,78640,primaire
0780805B,Ecole maternelle Joseph Kosma,78,Verneuil-sur-Seine,78480,primaire
0780806C,Ecole maternelle Etang des Noés,78,La-Verrière,78320,primaire
0780807D,Ecole élémentaire Marie Curie,78,Vaux-sur-Seine,78740,primaire
0780808E,Ecole élémentaire,78,Mondreville,78980,primaire
0780812J,Ecole Générale et Technologique privée British School of Paris,78,Croissy-sur-Seine,78290,secondaire
0780813K,Ecole élémentaire Les Charvaux,78,Andrésy,78570,primaire
0780815M,Ecole maternelle Francis Jammes,78,Magny-les-Hameaux,78114,primaire
0780816N,Ecole maternelle Les Violettes,78,Mantes-la-Jolie,78200,primaire
0780820T,Ecole élémentaire René Coty,78,Maule,78580,primaire
0780821U,Ecole élémentaire Jacques Cousteau,78,Mantes-la-Jolie,78200,primaire
0780822V,Ecole élémentaire Duguesclin,78,Carrières-sous-Poissy,78955,primaire
0780823W,Ecole élémentaire François Rabelais,78,Plaisir,78370,primaire
0780824X,Ecole élémentaire Le Gandouget,78,Élancourt,78990,primaire
0780825Y,Ecole élémentaire Louise Weiss,78,Magny-les-Hameaux,78114,primaire
0780826Z,Ecole élémentaire Champmesnil,78,Le-Mesnil-Saint-Denis,78320,primaire
0780827A,Ecole maternelle Le Parc,78,Gargenville,78440,primaire
0780830D,Ecole maternelle du Village,78,Montigny-le-Bretonneux,78180,primaire
0780832F,Ecole maternelle,78,Thoiry,78770,primaire
0780833G,Ecole maternelle,78,Longvilliers,78730,primaire
0780834H,Ecole maternelle Chêne Sorcier,78,Les-Clayes-sous-Bois,78340,primaire
0780835J,Ecole maternelle André Briquet,78,Les-Clayes-sous-Bois,78340,primaire
0780836K,Ecole maternelle,78,Les-Loges-en-Josas,78350,primaire
0780839N,Ecole maternelle Le Petit Prince,78,Le-Chesnay,78150,primaire
0780845V,Collège Emile Zola,78,Vernouillet,78540,secondaire
0780846W,Collège Le Rondeau,78,Rambouillet,78511,secondaire
0780847X,Collège Jean Moulin,78,Croissy-sur-Seine,78290,secondaire
0780848Y,Section d'enseignement général et professionnel adapté du Collège Pierre et Marie Curie,78,Le-Pecq,78230,secondaire
0780855F,Ecole élémentaire Marcel Pagnol,78,Beynes,78650,primaire
0780856G,Collège L' Agiot,78,Élancourt,78990,secondaire
0780857H,Ecole maternelle Les Larris,78,Chatou,78400,primaire
0780858J,Ecole maternelle Lucien Waterlot,78,Houilles,78800,primaire
0780859K,Ecole élémentaire Louis Pasteur,78,La-Celle-Saint-Cloud,78170,primaire
0780864R,Ecole élémentaire Pierre et Marie Curie,78,La-Celle-Saint-Cloud,78170,primaire
0780869W,Ecole élémentaire Auguste Renoir,78,Bougival,78380,primaire
0780871Y,Ecole élémentaire Claude Monet,78,Bougival,78380,primaire
0780873A,Ecole maternelle Robert Desnos,78,Achères,78260,primaire
0780874B,Ecole maternelle Clos de La Salle,78,Le-Mesnil-le-Roi,78600,primaire
0780876D,Ecole élémentaire Villedieu,78,Élancourt,78990,primaire
0780878F,Ecole maternelle Robert Desnos,78,Sartrouville,78500,primaire
0780879G,Ecole maternelle Maurice Ravel,78,Les-Mureaux,78130,primaire
0780880H,Ecole maternelle Les Marronniers,78,Magnanville,78200,primaire
0780881J,Ecole maternelle Sablonnière,78,Mantes-la-Ville,78711,primaire
0780885N,Ecole élémentaire Maurice Berteaux,78,Carrières-sur-Seine,78420,primaire
0780889T,Ecole élémentaire Félix Toussaint,78,Houilles,78800,primaire
0780890U,Ecole élémentaire Jules Guesde,78,Houilles,78800,primaire
0780891V,Ecole élémentaire Ferdinand Buisson,78,Houilles,78800,primaire
0780892W,Ecole élémentaire Paul Brejeat,78,Houilles,78800,primaire
0780893X,Ecole élémentaire Réveil Matin,78,Houilles,78800,primaire
0780895Z,Ecole élémentaire Gustave Flaubert,78,Trappes,78190,primaire
0780897B,Ecole élémentaire Frédéric Mistral,78,Bois-d'Arcy,78390,primaire
0780898C,Ecole élémentaire Madame Vigée Lebrun,78,Bois-d'Arcy,78390,primaire
0780899D,Ecole élémentaire Paul Langevin,78,Le-Chesnay,78150,primaire
0780901F,Ecole élémentaire Le Notre,78,Le-Chesnay,78150,primaire
0780904J,Ecole élémentaire Molière,78,Le-Chesnay,78150,primaire
0780907M,Ecole élémentaire Madame René Coty,78,Les-Clayes-sous-Bois,78340,primaire
0780909P,Ecole élémentaire Victor Hugo,78,Fontenay-le-Fleury,78330,primaire
0780910R,Ecole élémentaire Louis Pasteur,78,Fontenay-le-Fleury,78330,primaire
0780911S,Ecole élémentaire Paul Langevin,78,Guyancourt,78280,primaire
0780915W,Ecole élémentaire Alain Fournier,78,Plaisir,78370,primaire
0780918Z,Ecole élémentaire Jean Moulin,78,Plaisir,78370,primaire
0780919A,Ecole élémentaire Saint-Exupéry,78,Plaisir,78370,primaire
0780921C,Ecole élémentaire Chevreloup,78,Rocquencourt,78150,primaire
0780922D,Ecole élémentaire Jean Jaurès,78,Saint-Cyr-l'École,78210,primaire
0780923E,Ecole élémentaire Irène Joliot-Curie,78,Saint-Cyr-l'École,78210,primaire
0780924F,Ecole élémentaire Romain Rolland,78,Saint-Cyr-l'École,78210,primaire
0780926H,Ecole élémentaire Ernest Bizet,78,Saint-Cyr-l'École,78210,primaire
0780928K,Ecole maternelle,78,Thiverval-Grignon,78850,primaire
0780930M,Ecole élémentaire,78,Thiverval-Grignon,78850,primaire
0780932P,Groupe scolaire Jean Jaurès,78,Trappes,78190,primaire
0780934S,Ecole élémentaire Paul Langevin,78,Trappes,78190,primaire
0780935T,Ecole élémentaire Irène Joliot-Curie,78,Trappes,78190,primaire
0780937V,Ecole élémentaire,78,Montfort-l'Amaury,78490,primaire
0780939X,Ecole élémentaire Sully,78,Auteuil,78770,primaire
0780940Y,Ecole élémentaire,78,Autouillet,78770,primaire
0780941Z,Ecole élémentaire,78,Bazoches-sur-Guyonne,78490,primaire
0780942A,Ecole élémentaire du bois de houx,78,Béhoust,78910,primaire
0780945D,Ecole élémentaire,78,Boissy-sans-Avoir,78490,primaire
0780946E,Ecole élémentaire,78,Flexanville,78910,primaire
0780947F,Ecole élémentaire Marie Curie,78,Saint-Germain-en-Laye,78100,primaire
0780948G,Ecole élémentaire,78,Galluis,78490,primaire
0780951K,Ecole élémentaire,78,Goupillières,78770,primaire
0780952L,Ecole élémentaire,78,Grosrouvre,78490,primaire
0780953M,Ecole élémentaire,78,Marcq,78770,primaire
0780954N,Ecole maternelle sivos MBT,78,Mareil-le-Guyon,78490,primaire
0780955P,Ecole élémentaire,78,Méré,78490,primaire
0780957S,Ecole élémentaire,78,Les-Mesnuls,78490,primaire
0780960V,Ecole élémentaire Emile Serre,78,Neauphle-le-Château,78640,primaire
0780962X,Ecole élémentaire Marie de Cressay,78,Neauphle-le-Vieux,78640,primaire
0780967C,Ecole élémentaire Marcel Bouquet,78,La-Queue-les-Yvelines,78940,primaire
0780968D,Ecole élémentaire Jules Gohard,78,Saint-Germain-de-la-Grange,78640,primaire
0780969E,Ecole élémentaire,78,Saulx-Marchais,78650,primaire
0780970F,Ecole élémentaire Les Hirondelles,78,Tacoignières,78910,primaire
0780972H,Ecole élémentaire,78,Thoiry,78770,primaire
0780973J,Ecole élémentaire La Fermette,78,Le-Tremblay-sur-Mauldre,78490,primaire
0780975L,Ecole élémentaire,78,Villiers-le-Mahieu,78770,primaire
0780976M,Ecole élémentaire Les Marronniers,78,Magnanville,78200,primaire
0780977N,Ecole élémentaire les Sablons,78,Villiers-Saint-Frédéric,78640,primaire
0780978P,Ecole élémentaire Sablonnière,78,Mantes-la-Ville,78711,primaire
0780979R,Ecole maternelle Les Châtelaines,78,Triel-sur-Seine,78510,primaire
0781024P,Ecole élémentaire  Richard Mique,78,Versailles,78000,primaire
0781025R,Ecole élémentaire Marcel Lafitan,78,Versailles,78000,primaire
0781026S,Ecole élémentaire Carnot,78,Versailles,78000,primaire
0781027T,Ecole élémentaire Jérôme et Jean Tharaud,78,Versailles,78000,primaire
0781028U,Ecole élémentaire Jean-Baptiste de la Quintinie,78,Versailles,78000,primaire
0781030W,Ecole élémentaire Docteur Wapler,78,Versailles,78000,primaire
0781031X,Ecole élémentaire d'application les Condamines,78,Versailles,78000,primaire
0781032Y,Ecole élémentaire d'application Village de Montreuil,78,Versailles,78000,primaire
0781035B,Ecole élémentaire d'application La Source,78,Versailles,78000,primaire
0781037D,Ecole élémentaire Edme Fremy,78,Versailles,78000,primaire
0781040G,Ecole élémentaire Pierre Corneille,78,Versailles,78000,primaire
0781044L,Ecole élémentaire Perrault,78,Versailles,78000,primaire
0781045M,Ecole élémentaire Colonel de Bange,78,Versailles,78000,primaire
0781048R,Ecole élémentaire Les Arcades,78,Viroflay,78220,primaire
0781049S,Ecole élémentaire Camille Corot,78,Viroflay,78220,primaire
0781051U,Ecole élémentaire L'Aulnette,78,Viroflay,78220,primaire
0781053W,Ecole élémentaire Pré Saint-Jean,78,Buc,78530,primaire
0781054X,Ecole élémentaire Emile Mousseau,78,Jouy-en-Josas,78350,primaire
0781057A,Ecole élémentaire Bourget Calmette,78,Jouy-en-Josas,78350,primaire
0781061E,Ecole élémentaire Jean Mermoz,78,Vélizy-Villacoublay,78140,primaire
0781063G,Ecole élémentaire Jean Macé,78,Vélizy-Villacoublay,78140,primaire
0781077X,Ecole maternelle des Crayons,78,Mareil-sur-Mauldre,78124,primaire
0781098V,Collège George Sand,78,Magnanville,78200,secondaire
0781099W,Section d'enseignement général et professionnel adapté du Collège Maurice Ravel,78,Montfort-l'Amaury,78490,secondaire
0781101Y,Collège Le Corbusier,78,Poissy,78300,secondaire
0781105C,Collège Le Cèdre,78,Le-Vésinet,78110,secondaire
0781106D,Collège Hoche,78,Versailles,78000,secondaire
0781107E,Collège Jean Philippe Rameau,78,Versailles,78000,secondaire
0781108F,Collège René Cassin,78,Chanteloup-les-Vignes,78570,secondaire
0781111J,Ecole élémentaire Roger Colart,78,Les-Essarts-le-Roi,78690,primaire
0781112K,Ecole maternelle Montessori,78,Limay,78520,primaire
0781116P,Ecole élémentaire Louis Pergaud,78,Montesson,78360,primaire
0781117R,Ecole élémentaire d'application Ampère,78,Saint-Germain-en-Laye,78100,primaire
0781118S,Ecole élémentaire publique Bonnenfant,78,Saint-Germain-en-Laye,78100,primaire
0781119T,Ecole élémentaire Schnapper,78,Saint-Germain-en-Laye,78100,primaire
0781121V,Ecole élémentaire d'application Ecuyers,78,Saint-Germain-en-Laye,78100,primaire
0781123X,Ecole élémentaire Passy,78,Saint-Germain-en-Laye,78100,primaire
0781129D,Ecole élémentaire du Lycée international,78,Saint-Germain-en-Laye,78100,primaire
0781131F,Ecole élémentaire Giraud Teulon,78,Saint-Germain-en-Laye,78100,primaire
0781132G,Ecole élémentaire,78,Aigremont,78240,primaire
0781134J,Ecole élémentaire Châtaigneraie,78,Chambourcy,78240,primaire
0781138N,Ecole élémentaire Jules Ferry,78,Chatou,78400,primaire
0781139P,Ecole élémentaire Val Fleury,78,Chatou,78400,primaire
0781141S,Ecole élémentaire Jean Rostand,78,Chatou,78400,primaire
0781145W,Ecole élémentaire Charles Bouvard,78,Fourqueux,78112,primaire
0781151C,Ecole élémentaire Ferdinand Buisson,78,Montesson,78360,primaire
0781156H,Ecole élémentaire Général Leclerc,78,Le-Pecq,78230,primaire
0781163R,Ecole élémentaire Pallu,78,Le-Vésinet,78110,primaire
0781167V,Ecole élémentaire Princesse,78,Le-Vésinet,78110,primaire
0781171Z,Collège Albert Einstein,78,Magny-les-Hameaux,78114,secondaire
0781172A,Section d'enseignement général et professionnel adapté du Collège Jean Lurcat,78,Achères,78260,secondaire
0781173B,Section d'enseignement général et professionnel adapté du Collège René Cassin,78,Chanteloup-les-Vignes,78570,secondaire
0781174C,Ecole maternelle Jacques Prévert,78,Verneuil-sur-Seine,78480,primaire
0781176E,Ecole maternelle Les Bleuets,78,Mantes-la-Jolie,78200,primaire
0781178G,Ecole maternelle Louis Clément,78,Buc,78530,primaire
0781179H,Ecole maternelle George Sand,78,Trappes,78190,primaire
0781180J,Ecole maternelle Louis Pergaud,78,Trappes,78190,primaire
0781181K,Ecole maternelle Albert Camus,78,Trappes,78190,primaire
0781182L,Ecole maternelle Laurent Mourguet,78,Trappes,78190,primaire
0781183M,Ecole maternelle Le Gandouget,78,Élancourt,78990,primaire
0781184N,Ecole maternelle Elsa Triolet,78,Guyancourt,78280,primaire
0781185P,Ecole maternelle Jean de la Fontaine,78,Ablis,78660,primaire
0781186R,Ecole élémentaire Louis Clément,78,Buc,78530,primaire
0781187S,Ecole élémentaire George Sand,78,Trappes,78190,primaire
0781188T,Ecole élémentaire Louis Pergaud,78,Trappes,78190,primaire
0781189U,Ecole élémentaire Les Prés,78,Montigny-le-Bretonneux,78180,primaire
0781190V,Ecole élémentaire Jean Lurcat,78,Guyancourt,78280,primaire
0781191W,Ecole élémentaire Maurice Ravel,78,Les-Mureaux,78130,primaire
0781194Z,Ecole élémentaire les Iris,78,Montigny-le-Bretonneux,78180,primaire
0781196B,Ecole maternelle Les Petits Prés,78,Élancourt,78990,primaire
0781197C,Ecole élémentaire Pablo Neruda,78,Sartrouville,78500,primaire
0781198D,Ecole maternelle Pablo Neruda,78,Sartrouville,78500,primaire
0781199E,Ecole maternelle Frontenac,78,Saint-Germain-en-Laye,78100,primaire
0781201G,Ecole maternelle Marcel Pagnol,78,Coignières,78310,primaire
0781202H,Ecole maternelle Le Pré Gallot,78,Les-Essarts-le-Roi,78690,primaire
0781204K,Collège Marcel Roby,78,Saint-Germain-en-Laye,78101,secondaire
0781205L,Collège Claude Debussy,78,Saint-Germain-en-Laye,78100,secondaire
0781206M,Ecole maternelle Villedieu,78,Élancourt,78990,primaire
0781215X,École maternelle Centre,78,Morainvilliers,78630,primaire
0781216Y,Ecole maternelle Les Dauphins,78,Versailles,78000,primaire
0781217Z,Ecole maternelle La Farandole,78,Versailles,78000,primaire
0781219B,Ecole maternelle Charles Péguy,78,Poissy,78300,primaire
0781220C,Ecole maternelle La Bretechelle,78,Les-Clayes-sous-Bois,78340,primaire
0781221D,Ecole maternelle Bois de la Garenne,78,Voisins-le-Bretonneux,78960,primaire
0781222E,Ecole maternelle La Borde,78,Le-Vésinet,78110,primaire
0781224G,Ecole élémentaire Auguste Renoir,78,Trappes,78190,primaire
0781226J,Ecole élémentaire Le Bois de la Garenne,78,Voisins-le-Bretonneux,78960,primaire
0781227K,Ecole élémentaire Les Sources,78,Saint-Germain-en-Laye,78100,primaire
0781229M,Ecole maternelle Raymond Gilles,78,Marly-le-Roi,78160,primaire
0781232R,Ecole maternelle Auguste Renoir,78,Trappes,78190,primaire
0781234T,Ecole maternelle La Boissière,78,Plaisir,78370,primaire
0781235U,Ecole maternelle Saint-Exupéry,78,Montigny-le-Bretonneux,78180,primaire
0781237W,Ecole maternelle Le Chapiteau,78,Maurepas,78310,primaire
0781238X,Ecole maternelle La Petite enfance,78,Élancourt,78990,primaire
0781239Y,Ecole maternelle,78,Cernay-la-Ville,78720,primaire
0781240Z,Ecole élémentaire Alexandre Turpault,78,Bois-d'Arcy,78390,primaire
0781241A,Ecole maternelle l'Orangerie,78,Bonnelles,78830,primaire
0781248H,Ecole maternelle Salvador Allende,78,Houilles,78800,primaire
0781250K,Ecole maternelle Les Trois Sapins,78,Conflans-Sainte-Honorine,78700,primaire
0781252M,Ecole maternelle Les Bois,78,Meulan-en-Yvelines,78250,primaire
0781254P,Ecole maternelle Marcel Pagnol,78,Les-Mureaux,78130,primaire
0781255R,Ecole maternelle l'Arlequin,78,Buchelay,78200,primaire
0781256S,Ecole maternelle Charles Bouvard,78,Fourqueux,78112,primaire
0781257T,Ecole élémentaire Robert Surcouf,78,Carrières-sous-Poissy,78955,primaire
0781258U,Ecole maternelle Le Bel Air,78,Rambouillet,78120,primaire
0781263Z,Collège La Couldre,78,Montigny-le-Bretonneux,78180,secondaire
0781267D,Ecole maternelle Les Tilleuls,78,Vernouillet,78540,primaire
0781268E,Ecole élémentaire Les Friches,78,Maurepas,78310,primaire
0781269F,Ecole élémentaire Victor Hugo,78,Les-Clayes-sous-Bois,78340,primaire
0781281U,Ecole maternelle Jean-Baptiste Colbert,78,Maisons-Laffitte,78600,primaire
0781282V,Ecole maternelle Les Mimosas,78,Mantes-la-Jolie,78200,primaire
0781283W,Ecole maternelle Marie Laurencin,78,Montesson,78360,primaire
0781285Y,Ecole maternelle Passy,78,Saint-Germain-en-Laye,78100,primaire
0781286Z,Ecole maternelle Fernand Léger,78,Sartrouville,78500,primaire
0781287A,Ecole maternelle La Fontaine,78,Versailles,78000,primaire
0781288B,Ecole élémentaire Champs Moutons,78,Chatou,78400,primaire
0781289C,Ecole élémentaire Les Petits Prés,78,Élancourt,78990,primaire
0781290D,Ecole élémentaire Robespierre,78,Guyancourt,78280,primaire
0781291E,Ecole élémentaire Poirier Saint Martin,78,Montigny-le-Bretonneux,78180,primaire
0781292F,Ecole élémentaire La Barantonnerie,78,Le-Perray-en-Yvelines,78610,primaire
0781295J,Ecole maternelle Quatre Vents,78,Conflans-Sainte-Honorine,78700,primaire
0781296K,Ecole maternelle Les Baronnes,78,Rosny-sur-Seine,78710,primaire
0781297L,Lycée général et technologique Plaine de Neauphle,78,Trappes,78190,secondaire
0781298M,Collège Clagny,78,Versailles,78000,secondaire
0781311B,Ecole maternelle Les Campanules,78,Mantes-la-Jolie,78200,primaire
0781312C,Ecole maternelle,78,Limetz-Villez,78270,primaire
0781313D,Ecole maternelle,78,Bennecourt,78270,primaire
0781314E,Ecole maternelle la ribambelle,78,Bréval,78980,primaire
0781316G,Ecole maternelle Les Dahlias,78,Carrières-sous-Poissy,78955,primaire
0781317H,Ecole maternelle Chevreloup,78,Rocquencourt,78150,primaire
0781318J,Ecole maternelle Les Champagnes,78,Chatou,78400,primaire
0781321M,Ecole maternelle La Ruche,78,Rambouillet,78120,primaire
0781322N,Ecole maternelle Michel de Montaigne,78,Trappes,78190,primaire
0781323P,Ecole maternelle Marie Noël,78,Montigny-le-Bretonneux,78180,primaire
0781325S,Ecole maternelle Charles Péguy,78,Montigny-le-Bretonneux,78180,primaire
0781326T,Ecole maternelle La Reinette,78,Fontenay-le-Fleury,78330,primaire
0781327U,Ecole élémentaire Marcel Pagnol,78,Coignières,78310,primaire
0781332Z,Ecole élémentaire Reine Astrid,78,Aubergenville,78410,primaire
0781335C,Ecole élémentaire,78,Aulnay-sur-Mauldre,78126,primaire
0781336D,Ecole élémentaire,78,Bazemont,78580,primaire
0781338F,Ecole élémentaire Joliot-Curie,78,Bouafle,78410,primaire
0781340H,Ecole élémentaire Jacques prévert,78,Chapet,78130,primaire
0781341J,Ecole élémentaire Victor Hugo,78,Ecquevilly,78920,primaire
0781342K,Ecole élémentaire Jules Ferry,78,Ecquevilly,78920,primaire
0781343L,Ecole élémentaire,78,Évecquemont,78740,primaire
0781344M,Ecole élémentaire Roger Vassieux,78,Flins-sur-Seine,78410,primaire
0781346P,Ecole élémentaire des quatre vents,78,Gaillon-sur-Montcient,78250,primaire
0781349T,Ecole élémentaire,78,Herbeville,78580,primaire
0781350U,Ecole élémentaire des crayons,78,Mareil-sur-Mauldre,78124,primaire
0781352W,Ecole élémentaire Jean-Baptiste Charcot,78,Maule,78580,primaire
0781356A,Ecole élémentaire,78,Montainville,78124,primaire
0781357B,Ecole élémentaire Paul Bert,78,Les-Mureaux,78130,primaire
0781358C,Ecole élémentaire Paul Raoult,78,Les-Mureaux,78130,primaire
0781359D,Ecole élémentaire Jules Ferry,78,Les-Mureaux,78130,primaire
0781361F,Ecole élémentaire Molière,78,Les-Mureaux,78130,primaire
0781362G,Ecole élémentaire Roux Calmette,78,Les-Mureaux,78130,primaire
0781363H,Ecole élémentaire Louis Pasteur,78,Nézel,78410,primaire
0781365K,Ecole élémentaire,78,Tessancourt-sur-Aubette,78250,primaire
0781369P,Ecole élémentaire Gabrielle Colette,78,Mantes-la-Jolie,78200,primaire
